{
  "schema": "mobilebuildmcp.output.scaffold-result",
  "schemaVersion": "2",
  "didError": false,
  "error": null,
  "data": {
    "summary": {
      "status": "SUCCEEDED",
      "platform": "iOS"
    },
    "artifacts": {
      "projectName": "SnapshotTestApp",
      "outputPath": "<TMPDIR>/ios",
      "workspacePath": "<TMPDIR>/ios/SnapshotTestApp.xcworkspace"
    }
  },
  "nextSteps": [
    "Important: Before working on the project make sure to read the README.md file in the workspace root directory.",
    "Build for simulator: mobilebuildmcp simulator build --workspace-path <TMPDIR>/ios/SnapshotTestApp.xcworkspace --scheme SnapshotTestApp --simulator-name 'iPhone 17'",
    "Build and run on simulator: mobilebuildmcp simulator build-and-run --workspace-path <TMPDIR>/ios/SnapshotTestApp.xcworkspace --scheme SnapshotTestApp --simulator-name 'iPhone 17'"
  ]
}
