{
  "schema": "mobilebuildmcp.output.scaffold-result",
  "schemaVersion": "2",
  "didError": false,
  "error": null,
  "data": {
    "summary": {
      "status": "SUCCEEDED",
      "platform": "macOS"
    },
    "artifacts": {
      "projectName": "SnapshotTestMacApp",
      "outputPath": "<TMPDIR>/macos",
      "workspacePath": "<TMPDIR>/macos/SnapshotTestMacApp.xcworkspace"
    }
  },
  "nextSteps": [
    "Important: Before working on the project make sure to read the README.md file in the workspace root directory.",
    "Build for macOS: build_macos({ workspacePath: \"<TMPDIR>/macos/SnapshotTestMacApp.xcworkspace\", scheme: \"SnapshotTestMacApp\" })",
    "Build & Run on macOS: build_run_macos({ workspacePath: \"<TMPDIR>/macos/SnapshotTestMacApp.xcworkspace\", scheme: \"SnapshotTestMacApp\" })"
  ]
}
